{
  "$schema": "https://json-schema.org/draft/2020-12/schema",
  "$id": "https://tryashley.ai/contracts/score_row.schema.json",
  "title": "ScoreRow",
  "description": "One scored answer: one row per (session, question). Stamps the instrument version, the scoring prompt version, and every model in the panel so the row can be reproduced and audited. Scores read the transcript only.",
  "type": "object",
  "additionalProperties": false,
  "required": [
    "score_row_id", "session_id", "question_id", "instrument_id", "instrument_version",
    "transcript_span", "panel", "aggregate", "disagreement", "scoring_prompt_version", "scored_at"
  ],
  "properties": {
    "score_row_id": {"type": "string", "pattern": "^[0-9a-f]{8}-[0-9a-f]{4}-[1-8][0-9a-f]{3}-[89ab][0-9a-f]{3}-[0-9a-f]{12}$"},
    "session_id": {"type": "string", "pattern": "^[0-9a-f]{8}-[0-9a-f]{4}-[1-8][0-9a-f]{3}-[89ab][0-9a-f]{3}-[0-9a-f]{12}$"},
    "question_id": {"type": "string", "pattern": "^q[0-9]{2}$"},
    "instrument_id": {"type": "string", "pattern": "^[a-z0-9]+(-[a-z0-9]+)*$"},
    "instrument_version": {"type": "integer", "minimum": 1},
    "transcript_span": {
      "type": "object",
      "additionalProperties": false,
      "required": ["start_ms", "end_ms", "text_hash"],
      "properties": {
        "start_ms": {"type": "integer", "minimum": 0},
        "end_ms": {"type": "integer", "minimum": 0},
        "text_hash": {"type": "string", "pattern": "^sha256:[0-9a-f]{64}$"}
      }
    },
    "panel": {
      "type": "array",
      "minItems": 3,
      "maxItems": 7,
      "items": {
        "type": "object",
        "additionalProperties": false,
        "required": ["rater_id", "rating", "rationale"],
        "properties": {
          "rater_id": {"type": "string", "pattern": "^[A-Za-z0-9._-]+@[0-9]{4}-[0-9]{2}(-[0-9]{2})?$"},
          "rating": {"type": "integer", "minimum": 1, "maximum": 5},
          "rationale": {"type": "string", "minLength": 20}
        }
      }
    },
    "aggregate": {
      "type": "object",
      "additionalProperties": false,
      "required": ["method", "score"],
      "properties": {
        "method": {"const": "median"},
        "score": {"type": "number", "minimum": 1, "maximum": 5}
      }
    },
    "disagreement": {"type": "integer", "minimum": 0, "maximum": 4},
    "scoring_prompt_version": {"type": "string", "pattern": "^scoring-v[0-9]+$"},
    "scored_at": {"type": "string", "pattern": "^[0-9]{4}-[0-9]{2}-[0-9]{2}T[0-9]{2}:[0-9]{2}:[0-9]{2}(\\.[0-9]+)?(Z|[+-][0-9]{2}:[0-9]{2})$"}
  }
}
