{
  "score_row_id": "33333333-3333-4333-8333-333333333301",
  "session_id": "22222222-2222-4222-8222-222222222222",
  "question_id": "q01",
  "instrument_id": "retail-associate",
  "instrument_version": 1,
  "transcript_span": {
    "start_ms": 41200,
    "end_ms": 118900,
    "text_hash": "sha256:9c1185a5c5e9fc54612808977ee8f548b2258d31f8d0d2f4a0f7c2f0f4a1b2c3"
  },
  "panel": [
    {"rater_id": "glm-5.3@2026-09", "rating": 4, "rationale": "Specific situation, action, and outcome; learning stated only briefly."},
    {"rater_id": "claude-sonnet-5@2026-09", "rating": 4, "rationale": "Clear example with action and result; what they would change is implied, not stated."},
    {"rater_id": "gpt-5@2026-09", "rating": 5, "rationale": "All four anchor elements present: situation, chosen action with reason, outcome, reflection."}
  ],
  "aggregate": {"method": "median", "score": 4.0},
  "disagreement": 1,
  "scoring_prompt_version": "scoring-v1",
  "scored_at": "2026-10-06T14:21:31Z"
}
