{
  "score_row_id": "33333333-3333-4333-8333-333333333302",
  "session_id": "22222222-2222-4222-8222-222222222222",
  "question_id": "q02",
  "instrument_id": "retail-associate",
  "instrument_version": 1,
  "transcript_span": {
    "start_ms": 119400,
    "end_ms": 187250,
    "text_hash": "sha256:4b8f7e2a1c9d6e3f5a0b7c8d9e1f2a3b4c5d6e7f8091a2b3c4d5e6f708192a3b"
  },
  "panel": [
    {"rater_id": "GLM-5.3@2026-09", "rating": 3, "rationale": "Handles the line in order but never mentions calling for backup."},
    {"rater_id": "claude_opus-5.5@2026-09-27", "rating": 4, "rationale": "Sets expectations and prioritizes quick requests; backup implied, not stated."},
    {"rater_id": "gpt-5@2026-09", "rating": 4, "rationale": "Acknowledges everyone and triages; asks a coworker to cover the register."}
  ],
  "aggregate": {"method": "median", "score": 4.0},
  "disagreement": 1,
  "scoring_prompt_version": "scoring-v1",
  "scored_at": "2026-10-06T14:21:36Z"
}
